{"action":{"action_id":"action-001","case_id":"stage3-preparation-001-r2","reason":"Predeclared provisional response B.","selected_action":"a_B","state_version":1},"admitted_evidence":[{"evidence_id":"e_B","permitted_candidates":["h_B"]}],"new_observation_ids":["e_B"],"schema_version":"stage3-input/v0.1","state":{"K":["h_A","h_B"],"action_id":"action-001","action_sha256":"6696a1684ea6128d198555cbb4273cb504e3f7e7d5adea45e039794e48bc0158","applied_evidence":[],"case_id":"stage3-preparation-001-r2","rule_version":"empty-basis-identity/v1","schema_version":"stage3-state/v0.1","version":1},"state_sha256":"fdd86f70a58f05c5cf346d5e6b9f74c1eaabeef215d66b8ec2b6edba5357f702","summary":{"admitted_as_evidence":false,"summary_id":"summary-001","text":"暫定対応Bを選択した。"}}
