{"action":{"action_id":"action-001","case_id":"stage3-preparation-001-r3","reason":"Predeclared provisional response B.","selected_action":"a_B","state_version":1},"admitted_evidence":[{"evidence_id":"e_B","permitted_candidates":["h_B"]}],"new_observation_ids":[],"schema_version":"stage3-input/v0.1","state":{"K":["h_A","h_B"],"action_id":"action-001","action_sha256":"d8415d46970c506cfb8354a82175ddd72c70f2fe694153f253366f0feae3fcd1","applied_evidence":[],"case_id":"stage3-preparation-001-r3","rule_version":"empty-basis-identity/v1","schema_version":"stage3-state/v0.1","version":1},"state_sha256":"a44daab5de28598b91903b92378fe921160b19753d5a2b8536aceae2c3b29213","summary":{"admitted_as_evidence":false,"summary_id":"summary-001","text":"暫定対応Bを選択した。"}}
