{"action":{"action_id":"action-001","case_id":"stage3-preparation-001-r1","reason":"Predeclared provisional response B.","selected_action":"a_B","state_version":1},"admitted_evidence":[],"new_observation_ids":[],"schema_version":"stage3-input/v0.1","state":{"K":["h_A","h_B"],"action_id":"action-001","action_sha256":"519dffde8b5b550e53377e3a9a29438c39665319f2b746f87f1d0004027e406d","applied_evidence":[],"case_id":"stage3-preparation-001-r1","rule_version":"empty-basis-identity/v1","schema_version":"stage3-state/v0.1","version":1},"state_sha256":"840af59b70df33e86f061e641ccb161c7231b4be71a73e54913041fccfb53409","summary":{"admitted_as_evidence":false,"summary_id":"summary-001","text":"暫定対応Bを選択した。"}}
